{"noble":{"maxHP":20.0,"maxMP":21,"maxAP":22,"damage":4.0,"inventorySize":8,"healingHP":6.0},"mentat":{"maxHP":20.0,"maxMP":21,"maxAP":22,"damage":4.0,"inventorySize":8,"healingHP":6.0},"beneGesserit":{"maxHP":20.0,"maxMP":21,"maxAP":22,"damage":4.0,"inventorySize":8,"healingHP":6.0},"fighter":{"maxHP":20.0,"maxMP":21,"maxAP":22,"damage":4.0,"inventorySize":8,"healingHP":6.0},"numbOfRounds":10,"actionTimeUserClient":0.0,"actionTimeAiClient":0.0,"highGroundBonusRatio":0.5,"lowerGroundMalusRatio":0.5,"kanlySuccessProbability":0.5,"spiceMinimum":10,"cellularAutomaton":"B2/S3","sandWormSpeed":10,"sandWormSpawnDistance":10,"maxStrikes":0,"cloneProbability":0.5,"minPauseTime":0,"crashProbability":0.40000000596046448}